{
  "schema": "aether.cloudlink.replay-request",
  "protocol": "aether.cloudlink",
  "message_kind": "replay-request",
  "gateway_id": "33333333-3333-4333-8333-333333333333",
  "session_id": "44444444-4444-4444-8444-444444444444",
  "session_epoch": "7",
  "credential_generation": "3",
  "stream_id": "telemetry",
  "stream_epoch": "4",
  "from_position": "19",
  "requested_at_ms": "1721000000250"
}
